{
  "$schema": "./schema/state.schema.json",
  "schemaVersion": 2,
  "project": {
    "name": "DraftForge",
    "draftFile": "docs/PRODUCT_SPEC.md"
  },
  "workflow": {
    "phaseId": "phase-04",
    "phaseName": "Delegated execution",
    "stage": "execution",
    "status": "in_progress",
    "currentTask": null,
    "nextTask": "P04-T03"
  },
  "phases": [
    {
      "id": "phase-00",
      "name": "Foundation",
      "status": "complete"
    },
    {
      "id": "phase-01",
      "name": "Local project lifecycle",
      "status": "complete"
    },
    {
      "id": "phase-02",
      "name": "Architecture interview and planning",
      "status": "complete"
    },
    {
      "id": "phase-03",
      "name": "Provider and harness adapters",
      "status": "complete"
    },
    {
      "id": "phase-04",
      "name": "Delegated execution",
      "status": "in_progress"
    },
    {
      "id": "phase-05",
      "name": "Review and recovery",
      "status": "not_started"
    },
    {
      "id": "phase-06",
      "name": "Release",
      "status": "not_started"
    }
  ],
  "tasks": [
    {
      "id": "P00-T01",
      "title": "Create and verify the foundation scaffold",
      "status": "done",
      "taskFile": ".draftforge/tasks/P00-T01.md",
      "dependsOn": [],
      "attempt": null
    },
    {
      "id": "P01-T01",
      "title": "Implement local project initialization",
      "status": "done",
      "taskFile": ".draftforge/tasks/P01-T01.md",
      "dependsOn": [
        "P00-T01"
      ],
      "attempt": null
    },
    {
      "id": "P01-T02",
      "title": "Atomic transitions, event log, and config discovery",
      "status": "done",
      "taskFile": ".draftforge/tasks/P01-T02.md",
      "dependsOn": [
        "P01-T01"
      ],
      "attempt": null
    },
    {
      "id": "P02-T01",
      "title": "Deterministic planning contracts and approval gate",
      "status": "done",
      "taskFile": ".draftforge/tasks/P02-T01.md",
      "dependsOn": [
        "P01-T02"
      ],
      "attempt": null
    },
    {
      "id": "P02-T02",
      "title": "Architect prompt and structured response orchestration",
      "status": "done",
      "taskFile": ".draftforge/tasks/P02-T02.md",
      "dependsOn": [
        "P02-T01"
      ],
      "attempt": null
    },
    {
      "id": "P02-T03",
      "title": "Recorded plan revision flow",
      "status": "done",
      "taskFile": ".draftforge/tasks/P02-T03.md",
      "dependsOn": [
        "P02-T02"
      ],
      "attempt": null
    },
    {
      "id": "P03-T01",
      "title": "Model-runner factory, role routing, and adapter reliability",
      "status": "done",
      "taskFile": ".draftforge/tasks/P03-T01.md",
      "dependsOn": [
        "P02-T03"
      ],
      "attempt": null
    },
    {
      "id": "P03-T02",
      "title": "Harness adapters: Codex CLI and Claude Code",
      "status": "done",
      "taskFile": ".draftforge/tasks/P03-T02.md",
      "dependsOn": [
        "P03-T01"
      ],
      "attempt": null
    },
    {
      "id": "P03-T03",
      "title": "API adapters: OpenAI and Anthropic",
      "status": "done",
      "taskFile": ".draftforge/tasks/P03-T03.md",
      "dependsOn": [
        "P03-T01"
      ],
      "attempt": null
    },
    {
      "id": "P03-T04",
      "title": "Doctor authentication checks and plan-command runner wiring",
      "status": "done",
      "taskFile": ".draftforge/tasks/P03-T04.md",
      "dependsOn": [
        "P03-T02",
        "P03-T03"
      ],
      "attempt": null
    },
    {
      "id": "P04-T01",
      "title": "Execution contracts, durable attempts, and dependency scheduler",
      "status": "done",
      "taskFile": ".draftforge/tasks/P04-T01.md",
      "dependsOn": [
        "P03-T04"
      ],
      "attempt": null
    },
    {
      "id": "P04-T02",
      "title": "Git-worktree workspace isolation and inspection",
      "status": "done",
      "taskFile": ".draftforge/tasks/P04-T02.md",
      "dependsOn": [
        "P03-T04"
      ],
      "attempt": null
    },
    {
      "id": "P04-T03",
      "title": "Bounded worker prompt, workspace execution, and evidence",
      "status": "ready",
      "taskFile": ".draftforge/tasks/P04-T03.md",
      "dependsOn": [
        "P04-T01",
        "P04-T02"
      ],
      "attempt": null
    },
    {
      "id": "P04-T04",
      "title": "Concurrent run orchestration, resume, and Phase 4 gate",
      "status": "backlog",
      "taskFile": ".draftforge/tasks/P04-T04.md",
      "dependsOn": [
        "P04-T03"
      ],
      "attempt": null
    }
  ],
  "decisions": [
    "docs/decisions/0001-node-typescript-cli.md",
    "docs/decisions/0002-provider-port-and-role-routing.md",
    "docs/decisions/0003-canonical-file-state.md",
    "docs/decisions/0004-delegated-execution-contract.md",
    "docs/decisions/0005-planning-artifact-and-approval-gate.md",
    "docs/decisions/0006-architect-response-contract.md",
    "docs/decisions/0007-recorded-plan-revision.md",
    "docs/decisions/0008-provider-adapter-contract.md",
    "docs/decisions/0009-durable-execution-attempts.md"
  ],
  "handoff": {
    "updatedAt": "2026-07-26T14:59:05.000Z",
    "updatedBy": "codex",
    "summary": "P04-T01 and P04-T02 are complete after parallel bounded implementation and an independent QA gate. DraftForge now parses strict task contracts, migrates canonical state to durable nullable attempt references, selects dependency-ready path-compatible work under concurrency limits, persists schema-valid redacted attempt evidence, and creates or safely recovers deterministic Git worktrees whose changed paths come from Git. QA found and repaired Windows reserved-path case handling, foreign nested-repository reuse, and incomplete test discovery. Typecheck, lint, all 151 tests, session check, and build pass; four opt-in live provider smokes skip. P04-T03 is ready.",
    "decisionsLocked": [
      "Use strict TypeScript, Node.js, npm, and ESM.",
      "Route architect, worker, and reviewer roles through provider adapters with configurable model IDs.",
      "Use .draftforge/state.json as canonical state and generate SESSION.md from it.",
      "Use DAG task contracts, isolated workers, and independent review before completion.",
      "Serialize task transitions with a project lock and append redacted events before atomic snapshot writes.",
      "Apply optional config.local.json as a deep override, then validate the merged configuration.",
      "Store resumable interview drafts and revision-bound approval in .draftforge/planning.json while keeping runnable task state authoritative in .draftforge/state.json.",
      "Materialize approved phase, ADR, and task files before making active-phase roots ready.",
      "Accept exactly one architect envelope per turn and derive the expected kind from planning state.",
      "Parse raw model text in src/application/ and validate it before it reaches domain state.",
      "Drive planning through plan --prompt, --submit, and --answer until Phase 3 adapters exist.",
      "Change an approved plan only through a recorded revision that carries answers forward and preserves recorded progress.",
      "Retain one superseded plan so re-materialization can tell generated files from user edits.",
      "Decompose Phase 3 by transport: shared runner/reliability foundation (P03-T01), harness adapters (P03-T02), API adapters (P03-T03), then doctor auth and plan wiring (P03-T04), with every adapter passing one reusable contract-test suite.",
      "Adapters map transport failures to AdapterError with a correct retryable flag; the runner centralizes timeout, retry, and redaction so authentication and contract errors are never retried.",
      "Codex CLI and Claude Code share an injectable shell-free child-process transport; prompts use stdin, provider-default omits the model flag, and explicit models are forwarded.",
      "OpenAI and Anthropic share an injectable fetch transport (no vendor SDK); keys come from the environment only, provider-default resolves to a default model constant in the provider layer, and HTTP 401/403 are terminal while 429 and 5xx are transient.",
      "The live API smoke tests require both the provider key and DRAFTFORGE_LIVE_SMOKE=1 so a routine npm run check never issues a paid request by surprise.",
      "Drive one provider-backed architect turn with plan --run; keep plan --prompt and plan --submit as unchanged manual checkpoints.",
      "Doctor checks only configured role adapters, caches duplicate routes, treats absent authentication as missing, and never surfaces environment values or subprocess output.",
      "On Windows, preserve where.exe PATH order, ignore unsupported extensionless aliases, spawn executables directly, and invoke npm-style .cmd/.bat shims through an escaped cmd.exe boundary while prompts remain on stdin.",
      "Represent every worker dispatch with a stable attempt reference in canonical task state and a schema-validated manifest under .draftforge/runs; claim under the project lock, then release it before workspace or model side effects.",
      "Treat workflow.currentTask as a display pointer only; task statuses and attempt references are the authoritative set of concurrent work.",
      "Use the task file referenced by canonical state as the execution contract, record its hash per attempt, normalize segment-aware path ownership, and reserve canonical state, SESSION.md, and run-control artifacts to the scheduler.",
      "Create deterministic Git worktrees under the run directory, preserve uncertain work, and resume the same attempt/worktree instead of transparently retrying a side-effecting worker call.",
      "Phase 4 workspace mutation is available only through workspace-capable local harness adapters; text-only API worker routes fail before claim until a separate patch/tool protocol is designed.",